,message,category
0,Which New Year's outfit do you like the most?,2
1,"Tatyana Brukhunova's fashionable bonnet, ""in terrible roses"", crocheted, is vigorously discussed on the Web. Many believe that a young woman dresses like a pensioner. Unusual image. Stylish?",2
2,Joggers are one of the stylish models of modern trousers.,2
3,"Vogue, 1950 г.",2
4,The large turndown collar trend is perfect for a romantic look.,2
5,This skirt with a lot of elements is a real helper in creating a bright look for a party.,2
6,An example of a well-executed make-up with a fox look due to additional eyelashes - suitable only for a special event,2
7,LV x NBA: AOC Catches Up With a Brilliant Virgil Abloh 'For the Ages' Collaboration Part 2,2
8,A stylish coat in white from Zara fits into this look.,2
9,Naeem Khan Pre-Fall Fall-Winter 2022/2023 Collection,2
10,"Consuelo Vanderbilt, Duchess of Marlborough (1877 - 1964) - a famous beauty, a representative of the Vanderbilt family of American millionaires, who married the 9th Duke of Marlborough. The richest bride of the Victorian era.",2
11,Stylish oversized jacket with very slender legs is a real bliss,2
12,"Quite an unusual option for the image, but nevertheless well-chosen!",2
13,"Every appearance of Kristen Stewart, a devoted long-term ambassador of Chanel, in the things of a not great French brand, is surprising. So for the Neon Rated evening in the chamber mansion, Kristen appeared in a heavy Dolce & Gabbana jacket, as if not sewn from fabric, but painstakingly assembled from emerald crystals. Kristen's stylists offered her a combination with dark green velvet biker shorts with black lace trim.",2
14,"A green bag here is considered an accent and a highlight not only due to the color, but also due to the unusual texture of the coating.",2
15,"Anna Sedokova and her worst dress, for which, according to her, she will always be ashamed",2
16,"“The main trend of 2022 is glazed tan. Share with your friends,” Hayley jokingly captioned the photo. A minimum of makeup and clothes, only positive emotions! Eh, it would be summer with white nights, verandas and the scorching sun.",2
17,"To avoid such situations, read reviews on the Internet!",2
18,"Since actress Megan Fox hired a new stylist, there has been no trace of a simple American in a plaid shirt and leggings: now the star appears in the best designer outfits and gets into the lists of the most stylish celebrities. And now, her new release is again worthy of applause. This time, Fox came out in a gray suit from the new Dion Lee collection: it consists of strict trousers that visually narrow the waist due to the “cross-shaped” cut, and a top with a spicy cutout on the chest. To complete the set, her stylist Maeve Reilly picked up lavender shoes and an Amina Muaddi handbag.",2
19,"Candice Swanepoel has long hung her ""angelic"" wings on a nail (the girl has long been one of the main models of Victoria's Secret), but despite this, she is in amazing shape and even tomorrow she is ready to go to the podium in her underwear. The star regularly demonstrates her amazing body on Instagram. Today, Candace shared pictures in a new tracksuit. For training, the girl chose a gray two-piece, consisting of sports trousers and a cropped sweatshirt with a zipper. Such a top perfectly emphasized the toned press of the model and her thin waist.",2
20,Max Mara Ready-To-Wear Collection Fall-Winter 2021/2022,2
21,"Elsa Hosk in most cases chooses oversized silhouettes, wide jeans and voluminous outerwear. The model reminded subscribers that under the layers of fashionable clothes she hides a flawless and toned body. The 33-year-old Norwegian celebrity poses in a new photo in a charming floral print bikini and spectacular turquoise Cossack boots. We add that in order to maintain a model figure, Elsa trains regularly, for 35 minutes a day, paying special attention to her legs, hips and abs.",2
22,"Kylie Jenner has announced the release of a new collection of her makeup brand Kylie Cosmetics. In addition to beauty novelties, the girl shared a bright picture in the theme of Valentine's Day. For the photo, the 24-year-old businesswoman tried on a spectacular pink mini-dress, the design of the outfit was specially designed for Kylie. The dress literally embodies the celebration of love: it is made in pink and red colors, there is a cutout in the shape of a heart at the waist, and a deep neckline will not leave anyone indifferent.",2
23,"Yasmine Gauri for YSL, 1990",2
24,"Every outing of Irina Shayk for a walk with her daughter proves that the model looks impressive not only on the podium, but also in everyday life. Choosing seemingly simple outfits, the Russian star still produces a wow effect. And today's appearance of the model on the streets of New York, accompanied by her daughter Leah, is another proof of this. For the day promenade, the model made up a black total bow, consisting of a short ""cheburashka"", leggings and high boots, which successfully emphasized the long and slender legs of the star. Again, we are convinced that no one wears black as effectively as Shake does.",2
25,Blumarine Pre-Fall Fall-Winter 2022/2023 Collection,2
26,"On February 1, 2022, the Balenciaga brand released the second part of the advertising campaign. And this is the very embodiment of luxury! It is no coincidence that Kim Kardashian has been walking the cherished outfits of the brand for half a year, it was she who became the main character of the shooting. In the most comfortable environment for yourself - in your own home; in the most comfortable position for yourself - taking a selfie; in the most comfortable clothes for themselves - endless over the knee boots and structured coats.",2
27,Braschi Ready-To-Wear Collection Fall-Winter 2021/2022,2
28,"Hungarian beauty Barbara Palvin is working hard to go beyond the exclusive world of fashion and wants to develop in the cinema. The picture was selected for participation in the California Film Festival, where the newly minted actress personally presented her arthouse debut. The famous lingerie model Victoria's Secret came to the premiere in a black velvet mini dress by Giorgio Armani, tailored in the manner of a fitted and elongated jacket.",2
29,Johanna Ortiz Ready-To-Wear Spring-Summer 2022 Collection,2
30,"A leather jacket is a great investment in a basic wardrobe. Such laconic outerwear successfully complements simple and practical outfits. For example, Gisele Oliveira this season offers to combine a leather jacket of the Parisian brand Herve Leger with an unbuttoned shirt, a miniskirt and classic ankle boots. The image of the 28-year-old Brazilian model complements interesting accessories - an ironic yellow-checked beret from the Topshop collection and a Hermes bag of a complex azure hue.",2
31,Alexis Mabille Couture Spring-Summer 2022 Collection,2
32,"When the first shock from Beyoncé's new haircut - the “powerful bob” - began to pass, the stylists finally started talking about the collection of clothes, which was dedicated to the beauty image. The singer single-handedly presented a new capsule dedicated to Valentine's Day. About great love and romance in it, of course, they speak of classic colors - red and pink. The superstar of the collection for February 14 is a sports transparent jumpsuit that pays tribute to the fashionable direction of color-block due to avant-garde inserts in pink and orange colors. They are thought out so cleverly that at the same time they perform the role of a “photoshop” in clothes: they visually make the buttocks more toned and rounded, increase the chest size and skillfully hide the waist. At the same time, the corrective model itself, with the exception of inserts, is absolutely transparent. This image of Beyoncé reminded us of the sports aesthetic of the 1990s and the fashion for aerobics. Very topical!",2
33,"The original brand with a crazy discount is a reality❗️❗️❗️Husband and wife living and working in Italy🇮🇹 buy branded clothes and shoes from boutiques and wholesalers in Italy. They have a discount on new collections, on all brands up to -40% and a discount on previous collections up to -70% of the boutique price❗️Fast delivery worldwide. We cooperate with more than 10 boutiques, visit us👇 https://t.me/brand_shopitaliahttps://t.me/brand_shopitaliahttps://t.me/brand_shopitalia",2
34,"Green is the most life-affirming and optimistic color of clothing for spring, which awakens the inhabitants of the metropolis who are tired of the dullness. So, Bella Hadid, who is preparing for the start of New York Fashion Week, is already shining in a freshly cut grass-colored crop top. The model was seen on one of the streets of the Big Apple in an interesting way. The star wore a crop top with a collar, wide jeans and rough boots. From above, the star threw on a beige leather jacket in the style of the 90s, and preferred a vintage Chanel model as a bag.",2
35,Coach Resort Spring-Summer 2022 Collection,2
36,Ulla Johnson Ready-To-Wear Collection Fall-Winter 2022/2023,2
37,"The main Hollywood ""Gossip Girl"" is close friends with Michael Kors, and even in moments of ""high secrecy"" in his personal life, he tries not to miss the brand's shows. Blake took a front row seat at the Fall/Winter 2022 collection show as part of New York Fashion Week. And at the same time she looked simply luxurious! The wife of Ryan Reynolds and the mother of three children can safely consider herself an unofficial brand ambassador without an official title. ""Glamour of the big city"", embedded in the DNA of Michael Kors, she personifies impeccably. Lively looked radiant and ready for spring in a three-piece suit in a trendy soft blue hue. The place of trousers and vests in this set was taken by a shortened bra-top paired with a pencil skirt. It seems that there are simply no flaws in the figure of this famous woman. Sexy, yet very sophisticated.",2
38,"Every season, the show of the new Michael Kors Collection becomes one of the most significant and memorable events of New York Fashion Week. And the show that took place tonight was no exception. Michael Kors invited his muses to demonstrate his work: Gigi and Bella Hadid, Irina Shayk, Jill Kortlev, Emily Ratajkowski and other supermodels. The designer's girlfriends went out to the guests in evening dresses and shiny raincoats, coats with a ""predatory"" print and knitted suits - all these images are the personification of the new American classics for modern women who do not hesitate to demonstrate their strength and sexuality.",2
39,Carolina Herrera Ready-To-Wear Fall-Winter 2022/2023 Collection,2
40,"The other day, a Guerlain brand dinner was held in a Parisian restaurant. Among the guests of the event was the brand ambassador, Russian model and philanthropist Natalia Vodianova. For the evening, the 39-year-old celebrity chose a very effective and stylish look. Natalia made a bet on an unusual mini-dress with a charming pleated skirt and a complex top with draperies. The model complemented the outfit with laconic makeup with an emphasis on scarlet lips. Relaxed styling was a successful completion of the outfit.",2
41,Ulla Johnson Ready-To-Wear Collection Fall-Winter 2022/2023,2
42,Oscar de la Renta Ready-To-Wear Collection Fall-Winter 2022/2023,2
43,"Tina Kunaki became the face of the new H&M Studio collection, on her Instagram page the model posted the first frame from the advertising campaign. The 24-year-old celebrity is pictured posing in a stylish red sweatshirt with rivets on the sleeves. It is not the first season that this outerwear remains relevant. In the spring season, the olympian will also be in trend. In addition, such outerwear is a great alternative to blazers and will appeal to those who prefer a sporty style.",2
44,Prabal Gurung Ready-To-Wear Collection Fall-Winter 2022/2023,2
45,"The pandemic and the global lockdown have greatly affected the work of young designer Matty Bovan, who has taken a great interest in needlework and spent the whole year knitting and studying folk crafts in the States, where he recently moved. Most of all, the Briton was impressed by patchwork quilts, rag rugs and checkered towels. The result was a collection of Matty Bovan called Americana, which he presented as part of London Fashion Week. We honestly admit that creativity reminded us more of Russian “chubby” rag dolls-warmers for a teapot. Or folk amulets dolls, which were made from shreds and decorated with aprons. In this vein, it is symbolic that some of the images were presented on the catwalk by the Russian supermodel Irina Shayk.",2
46,"The show of the new autumn-winter Prada collection has ended in Milan. This season, the design duo decided to dedicate it to models - shortly before the start of the show, videos appeared on the brand's Instagram account, for which the main stars of the modeling business showed their children's photos and videos. Thus, the collection has become an ode to women, their lifestyle, beauty and inner strength. This, first of all, was expressed in contrasts: absolutely transparent skirts were combined with strict masculine-cut jackets and voluminous sheepskin coats, weightless dresses were worn over basic T-shirts, and laconic coats were decorated with bright fur inserts.",2
47,Chanel Couture Spring-Summer 2022 Collection,2
48,"How to understand what is stylish and what is not? How to choose really trendy things, easy to combine them and look good? If you do not plan to be professionally engaged in fashion and design, but want to conquer the basics of style for yourself, I recommend training your watchfulness: ▪ watch fashion shows ▪ at least 10 minutes a day « walk"" on Pinterest ▪ find cool photographers ▪ subscribe to trendsetters - top designers, stylists, models read the blog at https://instagram.com/vikatorrez?utm_medium=copy_linkWatch, read, get inspired. Be stylish with https://instagram.com/vikatorrez?utm_medium=copy_link🤍",2
49,"The last day of the Milan Fashion Week ended loudly - with the show of the Bottega Veneta autumn-winter collection, created by the new creative director. Shortly before the show, the designer introduced an application in which everyone could connect to a live broadcast and see the images from all angles - according to the designer, this was done so that buyers could see things in motion, literally “feel” them with their eyes. The designer also said that this collection is the basis of a new era of the brand. In his work, he is going to use Bottega Veneta's connection with the Italian heritage, return to the era of the 70s, be inspired by cultural figures and art objects.",2
50,Dsquared2 Ready-To-Wear Fall-Winter 2022/2023 Collection,2
51,The largest store of women's bags and accessories in Russia! 👜🌂 - Direct suppliers; - High quality; - Low prices; - All goods are in stock; Subscribe to our telegram channel ❤️,2
52,"Tina Kunaki has become the new face of the Make Up For Ever advertising campaign. You definitely believe such a beauty with a catchy make-up! In social networks, she shared a beauty look with a bright make-up with an emphasis on sensual lips: a gradient in chocolate tones creates a magnetic effect. Note to owners of plump lips who want to experiment with a smile. On the contrast we perform the fashion-image of the star. The perfect frame is an Alexandre Vauthier dress in thin milky suede with oversized shoulders, delicate draping and a shawl skirt.",2
53,"Louis Vuitton closes in Russia The eminent French fashion house closes the doors of all its Russian boutiques from March 6th. The LVMH group of companies, the largest player in the luxury fashion sector, has announced for the first time that it is imposing its own restrictions on working with Russia. The official statement of the company says that more than a hundred stores of the Louis Vuitton brand in our country will be closed.",2
54,Luisa Beccaria Ready-To-Wear Collection Fall-Winter 2022/2023,2
55,"Pearl dresses, facial piercings and layered hoodies in the new Givenchy collection “I wanted to create a synthesis of powerful, sophisticated femininity with American and Parisian sports motifs,” describes the new Givenchy collection, creative director of the brand Matthew Williams. His idea was expressed in a combination of different textures and shapes: multi-layered sweatshirts with prints were worn with leather over the knee boots, jackets and bombers, and “multi-story” skirts made of transparent and fluffy fabric were combined with cropped tops, contrasting turtlenecks and sweaters.",2
56,"It is difficult to say exactly how the general obsession with the style of the 2000s began, but the Miu Miu spring-summer collection made a serious contribution to this “madness”, where low-rise microskirts became the main trend. As a result, they managed to appear everywhere: on the red carpet, on the covers of glossy magazines, on the instagrams of fashion influencers ... Absolutely everyone wanted these skirts (and continue to want them). And since the success is so deafening, why not repeat it? So, the autumn-winter season Miuccia Prada again proclaims the season of miniskirts - this time the designer suggests combining them with silk boxers, which must certainly look out, shortened polo, diamond-shaped sweaters and oversized jackets. In addition, the collection includes the same short shorts - they come with zip-up sweaters, shirts and long plaid coats.",2
57,"To his impressive collection of Grammy figurines, Billie Eilish is preparing to add the most coveted Oscar award. The performer, along with her brother-producer/composer, claims the award in the category ""Best Original Song"" for her work on the soundtrack for the latest Bond. She stepped onto the blue carpet ""in character"". Games in the cheerful blonde in the past, back to black hair and depressive facial expressions. Cocktail look for the 2022 Oscar nominees dinner - a Gucci set of a black velvet shirt, a nude skirt with a branded mesh and Mary Jane shoes on an impressive platform. Curtsey to the camera for bored fans.",2
58,Christian Dior Ready-To-Wear Collection Fall-Winter 2022/2023,2
59,"⚡️Transferring an Instagram platform to Telegram: a niche that needs to be developed together. The recently blocked (conditionally) and little-understood messenger Telegram was just gaining an audience, and now it is almost the only communication channel for expressing their thoughts and a whole platform for advertisers. At the moment, telegram is one of the last (if not the only) frontiers for free expression, doing business and distributing content and everything that you need to convey to the masses. The TGMPROMO team is ready to provide comprehensive support to bloggers who do not give up and transfer accounts to the platform messenger. In this regard, we offer discounts from 15% on advertising services. More information on the website or from the manager in private messages.",2
60,Jil Sander Ready-To-Wear Fall-Winter 2022/2023 Collection,2
61,"Biodepo is a Russian eco-friendly brand of natural cosmetics with natural essential oils and luxurious fragrances💚The products are approved by Ecogolik, are not tested on animals, and the packaging is made of recyclable plastic.If you are familiar with the problems of brittle, electrified and fluffy hair, then Biodepo brand products are a salvation your hair. And shower gels perfectly cleanse the skin! 🍀While all care brands raise their price tags, now Biodepo products can be bought at a nice price with a 25% discount at Wildberries, Ozon and Sbermegamarket",2
62,"Special offer 1000r discount for the first visit for new clients. At your service: - Lip contouring - Cheekbones - Correction of the lower third of the face - Chin - Profile, - Meso therapy - Buttock augmentation and much more * To receive a discount, you must subscribe to our telegram channel Telegram: https://t.me/lips_for_kiss#Advertising_material",2
63,Telegram channel with the most fashionable novelties of this season. Both world brands and own production. Only the best quality💫https://t.me/dymostudio,2
64,Chanel Ready-To-Wear Collection Fall-Winter 2022/2023,2
65,"Why can't you lose weight? What exercises are right for you? How does your diet affect your weight? What products can be taken on the shelves of the store, and which ones are better to bypass? These and other questions are answered by nutritionist Yulia Ushakova on the channel of the Kilo marathon in grams. Yulia is an honored master of sports and a two-time world champion, she still knows what needs to be done to look attractive .Sign up for the marathon http://kilotogram.com/ and in 21 days you will become the owner of a perfect body.",2
66,"Natalie Portman shone at the premiere of the film, appearing in a small scarlet Dior dress. The muse of the French brand completed the outfit with a “heart” neckline with an elegant matching blazer, a bag on a chain and shoes with an open heel. The stylists removed the beautiful brown-haired hair in a high bun, and in the makeup they relied on romance. The favorite “move” of makeup artists in the case of Natalie Portman was again a success - soft pink blush on the apples of her cheeks made the image fresh and radiant.",2
67,Victoria Beckham Ready-To-Wear Fall-Winter 2022/2023 Collection,2
68,"Dakota Johnson presented the drama ""Slowly Cha-Cha"" at the Texas Film Festival. It is curious that for Dakota this is already the second major role of a mother with a difficult child in the cinema (remember at least the recent “Unknown Daughter”). At the premiere, Dakota appeared in her favorite retro style of the 1970s, and in her favorite Gucci. The actress has long been friendly with the Italian brand. A suit in a hippie aesthetic with an active pattern and a nude bodysuit with cherished logos - it is difficult to imagine a better ambassador. Johnson incredibly goes this style, especially in combination with thick bangs from the same fashionable decade.",2
69,Lanvin Ready-To-Wear Fall-Winter 2022/2023 Collection,2
70,Dolce & Gabbana Ready-To-Wear Collection Fall-Winter 2022/2023,2
71,Coperni Ready-To-Wear Collection Fall-Winter 2022/2023,2
72,"Friends, the clothing brand ""Modus Fashion"" has its own telegram channel https://t.me/modusfashion 🔝Where almost every week they hold draws and indulge their subscribers with discounts🌪🌪But besides this, you will find advice from a stylist and a lot interesting, feminine things🙏❤️ In general, they will give you a spiritual atmosphere, love and mood.",2
73,Giambattista Valli Ready-To-Wear Fall-Winter 2022/2023 Collection,2
74,Giambattista Valli Ready-To-Wear Fall-Winter 2022/2023 Collection,2
75,"Trench coat - outerwear, which is always an image of the classic style, the trench coat is indispensable in the wardrobe of any woman. Its amazing ability to complement ""put together"" various sets, whether it be a sports or classic office suit, casual denim or evening wear, made this raincoat megapopular. Please yourself this spring, be irresistible! An order can be placed in my Pavana Bianco store at the Wildberries site, as well as at the link: https://www.wildberries.ru/catalog/66779886/detail.aspx?targetUrl=SN",2
76,Jean Paul Gaultier Couture Spring-Summer 2022 Collection,2
77,Jean Paul Gaultier Couture Spring-Summer 2022 Collection,2
78,Off-White Ready-To-Wear Fall-Winter 2022/2023 Collection,2
79,Natalie Portman in a photo shoot for ELLE Magazine France,2
80,Yohji Yamamoto Ready-To-Wear Fall-Winter 2022/2023 Collection,2
81,Jennifer Aniston (Jennifer Aniston) in a photo shoot for Vogue US,2
82,"If you don't know what look to choose for early spring, one of the most elegant women of our time, Rosie Huntington-Whiteley, is in a hurry to help you. A loose midi dress, complete with ankle boots and a small matching bag, will do all the work for you. An alternative to Rosie's dress easy to find among Russian brands. For example, Emka offers several options at once with a straight and A-silhouette. It remains to decide which dress you will choose.Subscribe to the brand's Telegram channel to receive information about the latest arrivals.",2
83,"Heidi Klum (Heidi Klum) at the party in honor of the ""Oscar-2022""",2
84,Versace Ready-To-Wear Fall-Winter 2022/2023 Collection,2
85,Tod's Ready-To-Wear Fall-Winter 2022/2023 Collection,2
86,"In the past, Kendall Jenner wore extremely provocative and very seductive dresses at the Oscars after-party. This year, the model made an exception and appeared in an unusual Balenciaga total look. The 26-year-old model wore an asymmetrical black dress with crinkle draperies, pointy leather ankle boots and futuristic-framed glasses. Long red hair Kendall collected in a neat high ponytail. The makeup artist of the actress relied on discreet makeup with an emphasis on arrows and matte lipstick.",2
87,"TV presenter and fashion historian Alexander Vasiliev visited the HC, who shared the latest news from the fashion world and showed the spring/summer 2022 trends. A full video with tips and tricks will be released very soon, don't miss it. And right now, a competition is taking place on the XC channel, in which Alexander Vasiliev's book ""PARIS-MOSCOW, LONG RETURN"" with the author's personal autograph is being raffled off. Hurry up to take part in the competition, maybe you will get an exclusive book! 👇🔸https://t.me/hcmodainfo/175",2
88,"Lily James (Lily James) at the party in honor of ""Oscar-2022""",2
