,message,category
89,"World mass market or Russian brands? We decided to take a closer look at the local women's clothing showrooms and were pleasantly surprised - in fact, our production is in no way inferior to the abundance of elegant classic looks and trendy items at affordable prices found in toplookspb.ru. Using the promo code “krasota”, you will have a 10% discount in stores and on the website until May 1 (for everything except the “Sale” section).",2
90,Dolce & Gabbana Ready-To-Wear Collection Fall-Winter 2022/2023,2
91,"Kim Kardashian (Kim Kardashian) at the party in honor of ""Oscar-2022""",2
92,Alberta Ferretti Ready-To-Wear Collection Fall-Winter 2022/2023,2
93,"Rita Ora (Rita Ora) at the party in honor of ""Oscar-2022""",2
94,Gigi Hadid (Gigi Hadid) in a photo shoot for Vogue Brazil,2
95,Irina Shayk at the annual ball of the Costume Institute Met Gala 2021,2
96,Giambattista Valli Ready-To-Wear Fall-Winter 2022/2023 Collection,2
97,Vittoria Ceretti at the annual ball of the Costume Institute Met Gala 2021,2
98,MSGM Ready-To-Wear Fall-Winter 2022/2023 Collection,2
99,✨️ Compatibility horoscope. Find out what signs you have perfect 💘Learn,2
100,"Zarina x Ruban collaboration and other fashion news of the weekZarina presented a collection with RUBANTwo Russian brands, Zarina and Ruban, launched a joint collection. The design duo of the Ruban sisters is known for their unconventional interpretation of classic models, which is also reflected in the new collection with Zarina. Convertible trench coats with detachable sleeves, wide trousers with cutouts at the waist, a cropped white shirt with ties are just a small part of the fashion experiments that you will find in the new collection. The project was implemented in cooperation with the fashion agency Front Row Buro.",2
101,"“You must have style. He helps you down the stairs. It helps to get up in the morning. It's a way of life. Without it, you are nothing. And now I'm not talking about the number of clothes. Diana Vreeland",2
102,"LONG CARDIGAN + NEON TURTLET There is a risk that a long cardigan in a neutral color can look like a find from a grandmother's chest. To prevent this, stylize the thing as boldly as possible: in the lookbook, we spied a combination with a neon turtleneck - it turns out extremely fresh.",2
103,"Julia Fox stars as flight attendant in Supreme campaign Julia Fox stars in Supreme's spring-summer advertising campaign. In photos and videos, the famous model poses as a flight attendant along with skateboarders Tyshawn Jones, Sean Pablo and Matthias Sauvageon. screenwriter of the cult film ""Children"" and director of the no less cult film ""Gummo"". Previously, he has repeatedly collaborated with Gucci and Alessandro Michele.",2
104,"Trends 2022 Mesh For Ludovic de Saint-Sernin, for example, the mesh turned out to be torn, while Regina Pio and Supriya Lele got a classic black and white lattice. Veneta), and headwear (Christian Cowan), and dresses (in the Halpern ballet collection), and tops with skirts (David Koma). So the trend of last season “a holiday that is always with you” will not weaken in the next season.",2
105,"Purple and orange is the trendiest color combination for spring We all remember that Pantone announced the 2022 color of the year lilac, very close to purple, or, as the Very Peri institute called it. And before that, we saw plum, lilac, eggplant and other similar shades in the spring-summer 2022 collections of Valentino, Isabel Marant and Lanvin.",2
106,"Oversized jackets in the spirit of the 1980s are backIt would seem that the statement that a good jacket must be oversized has already become a kind of fashionable axiom. However, in the wake of the universal love for the zeros over the past few seasons, the silhouettes have become narrower, and some designers have switched to completely fitted models that border on cardigans. Of course, there is nothing reprehensible in them, but still, the 2000s have already become a little boring and now, it seems, they are gradually receding.",2
107,"Pink is the color of love and freedom, insists Pierpaolo Piccioli. 30 items in the palette of the new Valentino collectionYesterday, as part of Paris Fashion Week, Pierpaolo Piccioli presented the Valentino autumn collection, made only in two colors - pink and black. There were many times more of the first at the show - at least because the podium and scenery were also painted in it. 40 models (out of 81), dressed from head to toe in pink, came out one after another at the beginning of the show, then they were interrupted by a line of total black looks, and we saw eight more triumphant pink looks at the finale.",2
108,"The bomber jacket is the ultimate street style jacket. American college style has taken the fashion world by storm. For example, bombers are now worn not only by football team players, but also by street style stars, among them guests of the Fall-Winter 2022 Fashion Weeks. They mainly preferred vintage models with colorful appliqués.",2
109,"How feminism is changing attitudes towards physicality and beauty standards Recently, the president instructed to consider the creation in Russia of a registry of ""toxic"" Internet content. The idea belongs to HRC member Igor Ashmanov - he insists that Russians need state protection from ""toxic"" information that harms our society. The list of topics identified by Ashmanov as “harmful and destructive” surprisingly included, among other things, radical feminism, the “ideology of childlessness” (childfree), abortion, and LGBT+.",2
110,"Spring is a great time to get rid of everything unnecessary in the wardrobe. And here the most difficult thing begins - how to part with the old things with which we are connected by memories of fun parties, best dates and travels? One of the most popular rules when doing an audit is to keep only those clothes that bring joy. It is quite blurry, so we decided to make it easier for you. To start the new season with a really disassembled closet, here are nine simple tips that will teach you to discard the unnecessary and determine at a glance what things it is time to go for recycling.",2
111,"The pacifist sign is one of the most recognizable in the world. But few people know that its official name is CND sign, and even less about the story behind it. The Pacific, an international symbol of peace, was created in 1958 by British artist, designer and Royal College of Art graduate Gerald Holtom. This logo was a symbol of nuclear disarmament, and the British Campaign of Nuclear Disarmament (hence the abbreviation CND sign) adopted it the same year.",2
112,"The new Chloé collection proves once again that leather trousers are a worthy alternative to jeans. Gabriela Hirst is one of those designers whose collections should not just be looked at, but studied. Her label Gabriela Hearst and Chloé, where she has been creative director since last year, hides not only an important eco-initiative, but also concern for those who will wear these clothes (remember the pockets with silver particles that prevent radiation from smartphones?). For fall-winter 2022, Hirst created an entire capsule wardrobe made of leather for Chloé, and although it is not eco-leather, there is also a conscious approach here.",2
113,"Literally every model appeared at The Row Resort 2023 show. They complemented long bustier dresses, trouser suits, strict straight-cut midi skirts, coats and trench coats. For all of us, this is the first year when we might not even notice that spring has come, and this season loafers are needed more than ever. On our own, we add that you can wear them with jeans, and with suits, and with a skirt of any length, and with straight-cut trousers. And one more argument - loafers will be a smart investment in your wardrobe. In other words, you can be sure that in the coming years they will definitely not lose their relevance.",2
114,"Now, when such events are taking place in the world, it is difficult to concentrate on anything other than the news bulletin. The advice to get distracted in these realities would be inappropriate and hardly appropriate, but we also suggest thinking about your body and helping it cope with stress for which it was clearly not ready. And sports will be an effective medicine - whether it's just aerobics, running or intense training in the gym. Once you start, and you will immediately get involved in the process, and the new sports uniform will become an additional motivation.",2
115,"A white shirt gets along with tailcoats, alcoholic T-shirts, trouser suits and long skirts. They are a staple of Caroline Bessette-Kennedy's wardrobe and are still loved by Carolina Herrera. And it is also the basis of the office wardrobe and at the same time - paradoxically - and a symbol of freedom.",2
116,"Paris Fashion Week opened with a tribute show to Virgil Abloh, a man who, without exaggeration, changed the fashion world and people along with it. After the designer's death, it was immediately clear that the show of his latest Off-White collection (as well as the last collection of Louis Vuitton) would be emotional and memorable. To honor the memory of Virgil Abloh and pay tribute to him, supermodels and other stars took to the podium.",2
117,"Virgil is a designer to whom few people were indifferent. He was ardently loved by young people who were ready to spend the night in lines for sneakers from his new drop, and just as ardently scolded by respected fashion critics. An architect by training, a creative consultant and a DJ by vocation, he has created more mixtapes than groundbreaking designs in fashion. He was often accused of plagiarism and not taken too seriously - understanding the fact that he was part of a new generation of designers, but not accepting the vast majority of what he did.",2
118,"And Balenciaga seems to be planning to bring neon back into fashion. Yesterday, Demna unveiled the brand's new ad campaign, starring Kim Kardashian and Isabelle Huppert. The third protagonist of this shoot was a neon green Le Cagole bag (better known as a biker bag thanks to American Vogue editor Liana Satenstein). Kim appeared with her in the frame - in an all-black look - so this bag became the only contrasting accent.",2
119,"The previous creative director of Burberry, Christopher Bailey, by the way, made such an attempt in 2012. True, he invited Adele as a plus-size design consultant, which made the whole idea more like a PR stunt. The singer seemed to agree and even discussed something with Bailey, but judging by the fact that today she weighs almost 50 kilograms less, she failed to revolutionize the industry. I had to lose weight - now Schiaparelli couture dresses by Daniel Roseberry and trendy young designer Harris Reed are sitting on her like a glove.",2
120,"Alexandra Maniovich, who graduated from Parsons in Paris in 2020, says that the institute encourages students to create plus-size fashion, but does not contribute to this: “On the one hand, teachers tell you: “There are different sizes, races and shapes” , and on the other hand, they do not give you the opportunity to make clothes for them, except for your own money. There were two size M mannequins for the entire university - all the rest are French 36th, that is, S.",2
121,"Rihanna's photos from last week (of her in a pink puffer jacket and ripped jeans) made it hard not to notice not only the big news she brought to the world, but also the massive jewelry that highlighted her belly. And if a fashion diva like Rihanna chooses a catchy vintage Christian Lacroix, and even on such an important occasion, this is a clear sign that large jewelry is back in fashion. (Moreover, it is not the first time she appears in them.)",2
122,"Chanel In 1978, Carl launches his first signature Lagerfeld cologne for men. In the 1980s, Lagerfeld became artistic director of Chanel. He ingeniously handled the legacy of the brand. In a word, Lagerfeld gave him back his life, because after the death of Coco, Chanel fell on hard times.",2
123,"“Fashion is an attempt to visualize aspects of reality that are invisible to the eye,” he wrote in the accompanying booklet for the 2005 Metropolitan Museum of Art Chanel exhibition. From the very first Chanel shows, Lagerfeld demonstrated his insightful understanding of the importance of imagery and hype. His collections have gained iconic status, with models on the runway wearing branded hockey sticks, surfboards and shopping carts. ""Lagerfeld's strength is that he is equally good at creating context and fashion clothes""",2
124,"Do you want to quickly update your wardrobe for spring, without resorting to drastic rearrangements? Make him sparkle with new colors. To do this, just add a few trendy shades that are right now running the show at Fashion Week. Let them dilute your monochrome images and help bring warming closer. Do you believe in the power of color therapy? Let it begin to act on the weather. As Rihanna said, fake it till you make it. Meet the top five spring-summer 2022 colors to add to your wardrobe right now.",2
125,"Among the followers of the trend is the Mugler brand. Its creative director, Casey Cadwallader, continues the legacy of the great Thierry Mugler by creating sexy clothes using cutting-edge technology. “Mugler’s concept is that clothes should not be restrictive, they should emphasize curves,” he said about his spring-summer 2022 collection.",2
126,"Florence Tethier, in her debut collection for Jean Paul Gaultier in 2021, referred directly to the brand's biggest hits: stretch tulle body stockings embellished with a recognizable Breton stripe and an optical illusion dress from the spring-summer 1996 collection. By the way, the vintage version was worn by Kim Kardashian in 2019. And Glenn Martens slightly updated the iconic mesh in his couture collection for Jean Paul Gaultier spring-summer 2022. We saw whimsical dresses with ruffles, rainbow print and other interesting details.",2
127,"There's still time before spring, and we can't wait to wear crop tops, miniskirts, and flowy dresses. As you update your outerwear, from light-coloured coats (while it's still cold) to trench coats, don't forget lighter pieces as well. In addition to shirts, T-shirts and T-shirts, you should also pay attention to bralettes. Influencers especially like to wear them with jackets - a standard combination, but on days when the weather changes every hour, they will help out as well as possible.",2
128,"in Milan, the Prada women's collection autumn-winter 2022 was shown - in the same place where Raf and Miuccia presented the last men's collection, in the Fondazione Prada building. The highlight of the new collection is the alcoholic tank top, an item that last hit the market just two years ago and that looks set to repeat itself in the near future.",2
129,"At the current Fashion Weeks, one global trend has been identified - designers are not trying to surprise anyone. The collections are based on simple, well-known wardrobe items – for example, the new Bottega Veneta by Mathieu Blasy and Prada has a white T-shirt, Jil Sander has a classic jacket in basic shades, and Gucci, Sportmax and Tod’s have a gray coat. We usually say about the latter that this is a smart investment in the wardrobe, because the gray coat will definitely not become outdated and will not go out of fashion, and in the autumn-winter 2022 season it will be a trend at all.",2
130,"If you are planning to update your wardrobe, a gray coat will be a smart investment. For example, rich blues, blues and yellows, as well as all the basic colors, so an overcast sky or wet asphalt coat in practice will be no less versatile than black.",2
131,"When creating a dress for his muse, the designer can only guess if it will become iconic. In 2003, Jennifer Lopez appeared in a luxurious mint-colored Valentino toga dress, embroidered with crystals along the hem. Since then, it has been included in all the collections of her best outings of all time, and in large part thanks to the idea behind this outfit - namely Jacqueline Kennedy.",2
132,"mint with an open shoulder, embellished with shimmering small crystals. Valentino created it as part of the autumn-winter 1967 haute couture collection. And will repeat it in 2001 for the Crown Princess of Greece Marie-Chantal and her appearance at the Met Gala. Not surprisingly, the theme of that year's Costume Institute ball was ""Jacqueline Kennedy: Years in the White House."" And although this dress belongs to the next period of Kennedy's life, it has become a cult in the history of her exits.",2
133,"So, the 55th Golden Globes ceremony. The Ray of Light Madonna, Michael J. Fox with another figurine, Kate Winslet shining after the Titanic - we definitely would like to visit this ceremony. Among the guests was Brooke Shields, who received a nomination for her lead role in the sitcom Unpredictable Susan. For her, it was a whole event, and, like any nominee, she approached the choice of outfit with special trepidation. The responsible mission was entrusted to Richard Tyler, now known to most as the judge of the Project Runway. Tyler has dressed top Hollywood actresses over the years and is one of Sarah Jessica Parker's favorite designers. For the Golden Globes in 1998, he created for Shields a scarlet bustier dress with a shawl.",2
134,"How to choose the right wardrobe in 2022? 👇🏻Specially for you, HC prepared answers to this and many other questions: ▪️ The main trends in women's wardrobe spring/summer 2022 ▪️ Trends in men's wardrobe in 2022 ✔️ Subscribe to be the first to know the news of the fashion world and be in trend with HC!👉https ://t.me/hcmodainfo",2
135,"Doll, prom queen, Marilyn Monroe - throughout her career, Courtney Love tried on many roles, and each played in an original manner. An exemplary blond, smeared smoky and “moved out” red lipstick - an image that you can’t confuse with anyone. And also - dresses from the Hollywood diva's wardrobe and silk combinations, in which she went on the red carpet and on stage at the ready with a guitar. And in fashion, she is clearly an underestimated figure. You ask: how can you become an icon of style, if one day the designer himself saw a fake dress of his authorship on you? Actually, it's possible. The current times with starlets bred by Pygmalion image makers only prove this - such genuine and sincere ones can hardly be found now, and this is the most important thing in matters of style.",2
136,"This is also Haider Ackermann and yes, there is a concept here too. The main action of the film takes place at night, when the vampire heroes can finally go outside. “So I decided that Tilda should be visible even at night, for this she should shine.” The image is not only an outfit, but also make-up, in which the designer also takes part. For example, in this case, red lips became his idea - they symbolize the blood that the main characters are forced to drink in order to continue to live.",2
137,"We are now, of course, not about the ultra-short dress of Santa's girlfriend, but about the top in the form of a butterfly, studded with rhinestones. He even appeared on the cover of the American ELLE - and on Salma Hayek herself, who then released several films and series a year. The cover was forgotten, but Mariah, who wore it in Madison Square Garden for a concert in honor of Diana Ross, was not. Top she complemented with jeans with a low rise popular at the time and graceful sandals.",2
138,"Barbra Streisand is a unique phenomenon of her time and a prime example of the fact that deviation from the mold leads to great success. She has always been a “funny girl”, a “Martian”, but most importantly, herself, and it was her acceptance of herself, in addition to her magical voice, charisma and acting talent, that became her main trump card up her sleeve. Today, Streisand is considered one of the most commercially successful women in show business - she is the only one who topped the Billboard 200 list for sixty years. Her musical career began in a gay bar in Manhattan in 1960, and in 1969 she received "" Oscar, and this time for his film debut - in the comedy Funny Girl by William Wyler. That evening was remembered not only by her and her fans, but in general by everyone who saw Streisand's outfit, at least in photographs.",2
139,"Naomi met Gianni Versace at the very beginning of her career. She was then 17 years old, but she had already posed for several editions of Vogue and received the title of one of the main models of her time. Subsequently, not a single show was complete without her participation. By the way, during the life of Versace, his shows were the only ones in which Naomi participated. Donatella Versace recalls: he even helped her dress for the show. He adored her, and she, thanks to his attitude towards her, considered herself part of the Versace family.",2
140,"As for the very definition of ""dangerous dress"", there is a nuance here. At first glance, a light, open and, well, very bold outfit, in fact, was a complex structure - a jumpsuit was sewn inside, warning against any embarrassment. Bella's main task was to carefully hide it, keeping the intrigue. Salser and Vautier had no doubts about the success, ""because Bella is self-confident and smart."" So the whole danger of the outfit came down to the failure of Operation Sensation - after all, if everyone knew about the existence of a secret leotard, it is unlikely that Bella would have hit the top requests in May of that year. Sometimes the legend is more important than the truth, and this principle has remained the main one for the industry over the past few years.",2
141,"Yesterday, Isabel Marant’s fall-winter 2022 collection was shown in Paris. To the live accompaniment of the American band Blonde Redhead (whose Isabelle Maran herself is a big fan of), models walked the runway in cargo pants, oversized jeans and fluffy sweaters. This collection was one of those that you want to instantly try on yourself.",2
142,"LOVERS IN THE BAR ❤️‍🔥 You sit in the bar and sip 🍹 Stockings and no underwear under your evening dress. Suddenly, a strange hand touches your back: “Can I treat you to another 🍸?” This is your partner who is standing behind you and pretending that he does not know you. Continuation of the game ⬇️https://t.me/filippovaanastasiya/2214",2
143,"One of the main headliners of the show was Naomi Campbell, a close friend of the designer, who also took part in the show of his final collection for Louis Vuitton in January. Other legendary supermodels of the 1990s appeared on the catwalk - Amber Valletta and Helena Christensen. They know better than anyone how much fashion has changed with the advent of Virgil Abloh. A new galaxy of models on the catwalk was represented by sisters Hadid, Kendall Jenner and Adut Akech. And the link between the two generations was the mother and daughter of Cindy Crawford and Kaia Gerber.",2
144,"If you've been following fashion weeks, you've probably noticed the color purple. Like green in 2021, next year it will also be impossible to ignore it - at past shows, designers not only added a couple of accent details, but dressed models in all shades of this color from head to toe.",2
145,"What do you associate lavender with? Provence, candied violets from Ladurée, Jeanne Damas cardigan - for us, this color primarily symbolizes France. It is also the color of spring. As you know, the right shade can become an effective psychotherapy, so lavender, which reminds us of holidays and the warmest days, gradually migrated to the autumn wardrobe - when we especially miss the sun and other joys of life.",2
146,"Nicola Brognano's love for lavender does not end with a knitted dress. He also came up with a smart elongated cardigan with a fur trim, which he suggests wearing with a belt from zero and flared jeans - not only Paris Hilton in the early 2000s, but also Bella Hadid could easily dress like that.",2
147,"More and more international brands leave Russia every day. The work of stores (including online) has already been suspended in the country by H&M Group (H&M, COS, & Other Stories, etc.), Inditex (Zara, Massimo Dutti, Pull & Bear, etc.), Kering and LVMH . How the situation will develop further is unclear. But one thing is clear: these changes will probably lead to an increase in interest in Russian brands.",2
148,"American college style has taken the fashion world by storm. For example, bombers are now worn not only by football team players, but also by street style stars, among them guests of the Fall-Winter 2022 Fashion Weeks. They mainly preferred vintage models with colorful appliqués.",2
149,"Bombers were also presented by Matty Bovan at London Fall-Winter 2022 Fashion Week. The designer admits that he was inspired by punk style. In addition, Vetements and Versace had such jackets at the spring-summer 2022 shows, as well as Burberry and Givenchy at the 2022 cruise collections.",2
150,"Yesterday the first physical show of Cecilie Bahnsen took place in Paris. Danish designer and London-based Royal College of Art graduate Cecile Bunsen, whose airy “princess dresses” have become incredibly popular in 2020, showed on the catwalk everything that fashion influencers around the world love her brand for: doll-like, feminine, naive outfits, voluminous, but seemingly weightless silhouettes and a touching ""childishness"", which somehow coexists in her works with a complex design.",2
