,message,category
202,"London - William Vintage and Rellik Whether Amal Clooney wore a stunning Greek-inspired gown to one of her last Buckingham Palace parties or Meghan Markle's royally elegant coats, head to William Vintage in London's Marylebone for this style. And don't be surprised to see Victoria Beckham shopping there. Here you will find items from the archive collections of Dior, Chanel, Versace, Courrèges, Balenciaga, Alexander McQueen, Yves Saint Laurent and Gucci from the time of Tom Ford.",2
203,"Milan - Vintage Delirium by Franco IacassiIt is said that some designers often go to Vintage Delirium, founded by the famous Italian collector Franco Iacassi, in search of inspiration. Chiara Ferragni and Attico brand founder Giorgia Tordini like to shop here. “If you are looking for Yves Saint Laurent of the 1960s and 1970s, you are here - there are a lot of dresses, shirts and belts in immaculate condition,” Tordini shares an insider.",2
204,"Anyone on the hunt for old Céline should definitely add Paloma Vintage to their shopping list. “I always buy only what I would wear myself, that’s my main principle,” says Paloma Vintage owner Ferial Berry, whose own wardrobe consists mainly of vintage jackets and dresses, like Michelle Pfeiffer in Scarface. Store offers a wide selection of Chanel, Ralph Lauren, Emanuel Ungaro, Loewe, Oscar de la Renta, Missoni, Dior and items from major department stores like Saks Fifth Avenue.",2
205,"Sydney - Blue Spinach Blue Spinach is located in the suburbs of Sydney, in the Darlinghurst area, and is considered the main second-hand store in Australia. Here you will find clothes and accessories from the women's and men's collections of Balmain, Yves Saint Laurent, Tom Ford, Balenciaga, Hermès, Chanel, Louis Vuitton, Gucci, Christian Dior, Valentino, Lanvin, Givenchy, Dolce & Gabbana, Alexander McQueen, Fendi, Céline and many others. “Now the most active buyers from us are waist bags, mini-bags and bags with a long strap,” says Jane Thompson, co-founder of Blue Spinach.",2
206,"Where to find bright summer looks with discounts up to 50%? Check out HC! 🌼It's up to you to decide how you see yourself this summer, because the HC presents clothes from European brands: Boss, Emporio Armani, Escada, Guess, Hugo, Penny Black, Tom Tailor and many others. Create bright and rich or delicate and pastel images with us!👉 Subscribe!",2
207,"San Francisco - Simply ChicSimply Chic boasts some of the best selection of designer vintage on the coast, with pieces from Chanel, Hermès, Louis Vuitton and more. “We select everything by hand, carefully checking all the “candidates” for authenticity,” says store owner Sophie Chen. “We are especially proud of our range of fashion bags.” The choice of shoes here is also impressive - Christian Louboutin, Gucci, Prada and Aquazzura and others. The pearl of the collection is Chanel's archival tweed suits in pastel shades.",2
208,"Mexico City - VoidLocated in the affluent Condesa district, Void offers a wide selection of famous brands and local designers. Here you will find unique items from Chanel, Courrèges, Hermès, Céline, Gucci, Dior, Louis Vuitton, Balmain and Moschino, as well as period costumes from the 1800s. Its founder is Mexican model and influencer Olympia de la Macorra, who constantly travels the world in search of the most interesting things.",2
209,"New York Fashion Week: September 7-12, Collina Strada will open the New York show, while Tom Ford will close as always. Both screenings must take place in a real format. Live shows are also expected to be shown by Michael Kors (the designer will celebrate the 40th anniversary of his brand on the runway), Coach, Gabriela Hearst, Anna Sui and Carolina Herrera, as well as favorites of the New York public Rodarte, Proenza Schouler, Peter Do, Puppets & Puppets, Maryam Nassir Zadeh, Vaquera and Eckhaus Latta. As an exception, Jeremy Scott decided to organize a show in his native land, although Moschino is usually a participant in Milan Fashion Week.",2
210,"At Paris Fashion Week Fall-Winter 2022, Maria Grazia Chiuri presented the Next Era collection. Sets with portraits of influential women in history, new technologies in clothing combined with handicraft - what else you need to know about the collection, says British Vogue fashion critic Anders Christian Madsen.",2
211,"Shoes have become a kind of “code-breaking” of the fashion house. As part of her high-tech experiment, Chiuri turned to the Dior archives. She was inspired by the work of fashion designer Roger Vivier for the fashion house a decade ago, which can be described as the first ""designer codebreaking"" - as we now call collaborations between brands such as Gucci and Balenciaga. “When Vivier met Monsieur Dior in 1953, they decided for the first time in history to create pieces with their own logos. It was a way of recognizing Vivier as a master of his craft and a true couturier in the world of shoes, because all of his creations were presented in a single copy, ”explained Chiuri. She reimagined the pointed toe and chunky soles that Vivier created at the time and structured them with D-Air Lab adjustable tech ankle straps. The result is a practical design that looks very modern.",2
212,"There was a place for manual work In addition to flirting with new technologies, Chiuri also relied on manual work. Floor-length skirts separated by delicate fringes, bustier dresses with embroidery, corsets and capes made of mesh - all this was painstakingly created by the craftsmen. Some of the looks towards the end of the collection were inspired by the Jardin d'Hiver tapestry that adorned Christian Dior's winter garden. Although it was a high-tech collection, the heart of Chiuri still belongs to the masters. “For me, technology should help people live better lives. Not to escape reality. There should always be a human touch,” she said. This touch became the handwork of the masters.",2
213,"How did the works of the artists affect the design of things? Carrington used a very beautiful color palette in her works, which partly migrated to the collection. Some of Miller's photos seem to be in a haze, we used this technique in one of the dresses, sewing it from flowing velvet. Another dress is embroidered with the phrase Blanche et muette, habillée des pensées que tu me prêtes, which translates as ""White and silent, dressed in the thoughts you lent me."" There is an irony in it: this is a line from a poem by the Belgian poet Marcel Marien, men, and we wanted to convey the idea that women are not just muses, but artists.",2
214,"For Wendy Yu, the beauty of haute couture is the opportunity to work with the designer in person, which gives you a sense of privilege, because the outfit is made especially for you, almost turning into a work of art. “One of my favorite dresses in the collection is Dior, similar to the one that Jennifer Lawrence wore to the Oscars in 2013,” says Yu. “It took six months to create it, and we had to do as many as five fittings in the atelier” . When asked what will happen to all this goodness in the future, Wendy Yu answers with an almost ready-made business plan. “I would like to open the first fashion museum in China. Therefore, I consider all my couture purchases as investments - after some time they will become part of fashion history.",2
215,"Stylists and make-up artists offered the viewer a real buffet full of extravagant tricks. The choice turned out to be so great that it was decided to deal with it not alone, but by a whole international team of Vogue beauty editors. So, we tell you which trends are recognized as the most spectacular.",2
216,"Recently, designers are betting on exposure. On the catwalks, we increasingly see extremely short dresses, clothes with cutouts on different parts of the body, as well as translucent mesh outfits.",2
217,"Literally every model appeared at The Row Resort 2023 show. They complemented long bustier dresses, trouser suits, strict straight-cut midi skirts, coats and trench coats. For all of us, this is the first year when we might not even notice that spring has come, and this season loafers are needed more than ever. On our own, we add that you can wear them with jeans, and with suits, and with a skirt of any length, and with straight-cut trousers. And one more argument - loafers will be a smart investment in your wardrobe. In other words, you can be sure that in the coming years they will definitely not lose their relevance.",2
218,"Sofia SteinbergPretty Sofia from Novosibirsk, according to the laws of the genre, was found by a scout in her hometown - through him she got into Avant. The first trip was to Tokyo, then China. But, before sending Sonya on a “big voyage”, the agency taught the girl all the basics of the profession at the Avant Camp summer camp in Sochi, and then in Barcelona, ​​where she was seen by the teams of the world's leading agencies. After training, Sofia went to conquer Europe. The first important show for her career was in Milan - Sonya went to Jil Sander. With this brand, the model continues to cooperate to this day - she goes to shows and starred in lookbooks. In November 2018, Sonya changed her image and cut off her hair under a bob, after which she made a “perfect” season - in February and March she appeared on Givenchy, Louis Vuitton, Maison Margiela, Prada, Versace.",2
219,"The rising fashion star was discovered by a scout for a small Dutch modeling agency while shopping with her mother. The success story began for Alyssa with participation in the IMG Models competition, which he held on Instagram under the hashtag WLYG (We Love Your Genes). After walking in the Jacquemus and Marni shows, she hit the jackpot as one of the models for Calvin Klein's grand 19th Anniversary Spring/Summer 2018 show.",2
220,"Chungji Liu Age: 23 Country: China Height: 178 cm Agency: Supreme Management Liu is an interior designer by training and began her serious modeling career after participating in a contest by her parent agency, China Bentley. Liu has run shows for brands like Proenza Schouler, Dior and Acne, and we look forward to seeing her at New York Fashion Week.",2
221,"Makeup like Bratz dolls is one of the main beauty trends of the outgoing year. We think our readers know that the style of the 2000s is now one of the main trends. Someone is inspired by the icons of the 2000s like Britney Spears or Paris Hilton, and someone is looking for references in their favorite cartoons of that time and even in children's toys. So, for example, now Bratz dolls, which appeared back in 2001, have regained great popularity (later they made an animated series about them). References to them can be seen both in fashion designers (remember the cool chunky-soled shoes from Versace's autumn-winter 2021 collection) and in makeup artists. Bratz-style makeup just blew up Instagram in 2021. Below we tell you how to repeat the trend.",2
222,"On September 1, the preliminary schedule of the Paris Fashion Week became known: Kenneth Ize will open the show, and Chanel, Miu Miu and Louis Vuitton will present their collections on the last day. We also look forward to the shows of Dior, Thebe Magugu, Dries Van Noten, Cecilie Banhsen, Balmain, Coperini, Rick Owens, Raf Simons, Chloé, Valentino, Loewe, Hermès, Balenciaga... Paris Fashion Week, as always, is rich in high-profile names. Hopefully most brands will have their shows live.",2
223,"Whether you got purple things after the Pantone verdict or are just planning, one piece of advice - do not forget to think in advance how to wear this shade. And although at first glance it seems complicated, there are enough combinations with it - and both it-girls and fashion bloggers prove this.",2
224,"Today it is customary to say that there are no many jeans, and this is true. Especially if you look at the selection below - even two pairs of blue straight-cut jeans can be completely different, and a rare shade can inspire you to create an unusual outfit. Here are 13 of the most beautiful straight-cut models that will not go out of fashion for at least as many years as the iconic 501 turned today.",2
225,"Remember the touching tradition of British students putting a coin under the lining of loafers for good luck? It has long gone beyond the confines of the universities - today even pop stars like Steve Lacy do it. True, it will be possible to pull off such a trick only with penny loafers, which have such an overlay on the tongue, and not all loafers fashionable this season can boast of its presence. Purple Loewe, for example, do not have it, but is that a reason to deny yourself the pleasure of wearing them?",2
226,"At the last shows of Chanel and Miu Miu - completely different in spirit and content - this time there was something in common. The creative directors of the brands Virginie Viart and Miuccia Prada agreed that gray knitted bandeau tops are the most fashionable purchase of the coming fall. In the Miu Miu collection, the knitted top is fastened with touching little buttons, while the Chanel version is adorned with a signature camellia brooch. We saw a similar bra in the collection of the American brand Jonathan Simkhai. The most spectacular wardrobe item of the new autumn season has been found.",2
227,"On the occasion of the lifting of restrictions on parties in Moscow, it's time to head for spectacular accessories. Do not walk around in just one hat all winter. Beautiful headbands that you can buy right now are in the collections of Miu Miu, Simone Rocha, Burberry. Some are decorated with large rhinestones, others are completely made of beads. If you want something in the spirit of old Hollywood, take a look at Rosantica and Area accessories. In them you will definitely sparkle brighter than anyone at any social evening.",2
228,"Orange dress This year's experience has shown that the inhabitants of the planet are very lacking in vitamins, so with the onset of citrus season, lean on oranges. And next spring, be sure to get a bright orange-colored dress. It is unlikely to raise immunity, but the mood for sure. Sportmax, Acne Studios and Valentino highly recommend.",2
229,"“Voluminous things are our everything. Think The Row collection and their beautiful dresses or Balenciaga with unusual oversized coats. Next season, pink will become the most popular color. It has been adopted by many brands such as Adam Lippes, Rochas, Plan C, Rosie Assoulin and Partow. I especially advise you to pay attention to the pale pink Gabriela Hearst suit with a relaxed cut. Such softness has generally become one of the key trends of the season: this spring there are no masculine styles and excessive severity. Look for suits with fun prints at Sies Marjan, and feather-embroidered ones at Y/Project. If you still want a more business-like option, check out Rosie Assoulin's plaid suit with cropped trousers.""",2
230,"Trends: femininity, lingerie, tie-dyeKey brands: Calvin Klein 205W39NYC, Kwaidan Editions, Loewe, Stella McCartney, Chloé“In general, the spring-summer 2019 season was marked by a course on femininity. Designers worked a lot with materials such as chiffon, silk and georgette, inspired by lingerie style, these trends are visible in the Stella McCartney collection. I liked the unusual use of tie-dye. Examples can be found in Raf Simons at Calvin Klein 205W39NYC and Marine Serre, who has taken pastel tie-dye to tracksuits and dresses.",2
231,"Graffiti artBurberry creative director Riccardo Tisci asked his team to paint the wall of the fashion house's headquarters and then turned it into a print for a cruise collection. The DIY story was developed at both Stella McCartney and S.R. studio. LA. CA., and in other brands. Paint splattered on jeans or a fully painted trench coat, cruise season is all about creativity.",2
232,"A raincoat is perhaps one of the most unpopular items in your wardrobe, but once you wear a perfectly tailored model, you will realize that no raincoat will provide you with such comfort. In classic cut models, as in the Prada spring-summer 2021 collection, you can look no worse than in your favorite raincoat or coat. Miuccia Prada and Raf Simons, for example, suggest turning sleeves up to the elbows and wearing them unbuttoned so you can play up the shade of a top or shirt by creating a color composition. If you like a raincoat without a hood, match it with a bucket hat - the main thing is that it be made of waterproof material, such as nylon or leather. A raincoat can be worn not only in the office - when going to a gala reception, throw it over an evening dress, as in the WOS lookbook, and you will find yourself the most fashionable guest.",2
233,"It feels like 2022 has seen Carhartt hit its pop culture peak—despite the fact that celebrities of every caliber have proclaimed it their favorite brand over the past 15 years. Moreover, in all 132 years of its existence, it has never needed additional advertising or work with influencers - Carhartt clothes have always spoken for themselves. Back in the late 19th century, when the founder of the company, Hamilton Carhart, had only two sewing machines and five employees, the work clothes he sewed in Michigan were famous for the highest quality. Legend has it that Carhart's denim was so thick that not even a bullet could pierce it.",2
234,"If you haven't closed your tabs with street style photos during the fashion month, you may have noticed that many fashionistas have already adapted this trend to their wardrobe. One street style heroine pairs this top in contrast with baggy pants (a look worth repeating back to the office), while another wears a multi-slit long sleeve with skinny pants. In the selection below, we have collected the coolest tops that open the shoulders beautifully and are worth wearing right now.",2
235,"The second collection of Demna Gvasalia for Balenciaga looked like a repetition of the material covered. The same gigantic shoulders and heads ingrown into them, the same dresses and leggings filled with floral ornaments. Puffy jackets from the last collection were reduced to vests, the commercial success of which is beyond doubt. To the ""Chinese"" bags of last season, the designer added a new variety - rectangular transparent bags, in which blankets and pillows are usually sold, according to Balenciaga, they are decorated with colors and patterns worthy of the cheapest Chinese linen. Meanwhile, the hysteria around Gvasalia continues. He is already credited with the idea of ​​oversize, which is hardly less than the designer himself, and these very “Chinese” bags, as if there was no scandalous collection of Marc Jacobs for Louis Vuitton with exactly the same bags only in a cage and as if there was no Céline 2013 collection years, using these same prints.",2
236,"New names This season, Paris welcomes a wave of new talent. Marine Serre, whose skilful cuts and skillful blending of styles earned her an LVMH award, will present her spring/summer 2018 collection. Belgian Glenn Martens of Y/Project, known for his mastery of combining maximalist luxury with streetwear, is another designer worth following after winning the ANDAM award. The jury gave him support in researching innovative embroidery techniques, with which he will debut this season.",2
237,"As always, the Paris Fashion Week spring-summer 2020 will not be complete without heavyweight brands: Christian Dior (the show will take place on September 24 at 14:30), Givenchy (September 29 at 20:30), Saint Laurent (September 24 at 8:30 pm), Celine (September 27 at 8:30 pm), Valentino (September 29 at 5:00 pm), Chloé (September 26 at 10:00 am), Balenciaga (September 29 at 11:30 am) and Louis Vuitton (October 1 at 19:30). In the program of each - grandiose decorations, parades of top models and stars in the forefront.",2
238,"By this time, the damage caused to the country by the demonstrations will exceed one hundred and seventy million euros, but, as the Marquise de Pompadour said: “After us, even a flood!” It seems that fashion houses, whose shows were in jeopardy due to protests and lost some of the guests (the once harmless Tuileries suddenly seemed more dangerous than the Bois de Boulogne), wanted to troll the angry public - and made it so that in six months the same dominant Class. Hated, by the way, for the entire “progressive” France, for which bourgeois is a word with a negative connotation, and not a compliment at all.",2
239,"Telfar's first Paris show will take place on September 24: during New York Fashion Week, American-Liberian designer Telfar Clemens released a trailer announcing his brand's Paris show, starring Moonlight's Ashton Sanders. Even earlier, Telfar, together with artist Babak Redboy, arranged a sample sale in New York - items from the old collections of the brand could be bought at a 70 percent discount, which only fueled the hype around the brand before the show.",2
240,"“Voluminous things are our everything. Think The Row collection and their beautiful dresses or Balenciaga with unusual oversized coats. Next season, pink will become the most popular color. It has been adopted by many brands such as Adam Lippes, Rochas, Plan C, Rosie Assoulin and Partow. I especially advise you to pay attention to the pale pink Gabriela Hearst suit with a relaxed cut.",2
241,"Carolyn considers the sometimes tedious waiting at castings and fittings to be the only drawback of her work. “I am very impatient, it is difficult for me to sit in one place, but I try to fight it.”",2
242,"If you have already appreciated this trendy color combination and want to replenish your spring wardrobe with bright purple-orange and lemon things, then this is great.",2
243,"Leather + chiffon To the waist you are a princess in a translucent chiffon blouse with a turn-down collar, embroidery, puffed sleeves (I usually stop at one thing), and below you are a rock festival star in a short leather skirt and super brutal boots. It's also fun that this technique perfectly captures the essence of my playlist, where Harry Styles inevitably meets the Ramones and Paramore.",2
244,"Mix of sandy shades It somehow doesn’t work out for me in summer - the colors of medium tones are closer to me. Lately, most of my summer wardrobe - from birkenstocks to shirts - consists of various browns, beiges and sandy items. I like to combine them in one look and add something black - like a t-shirt, bag or glasses - to add contrasts.",2
245,"Belts with pendantsThe fashion of the East has been a leitmotif in many spring collections. For some, like Paco Rabanne, for example, oriental aesthetics was the main theme, while for others, for example, the Burberry collection, inspiration could be traced only in some details. Despite the completely different brand DNA, in the spring collections, the creative directors agreed on one thing: chain belts, like in the wardrobes of oriental beauties, will be the main fashion detail in the new season.",2
246,"Green And it's 1973, Elizabeth II returns to Vindayubilzor Castle after a day at the races. Her image is the standard of color blocking: a dress, coat and hat in a muted green hue, combined with white accessories.",2
247,"On November 11, Dolce & Gabbana staged a couture show at their new London store on Old Bond Street, bringing together the Alta Moda women's haute couture collection and the Alta Sartoria men's collection. And all this just 10 days after the opening of the magnificent New Year's market in Harrods, which, according to rumors, cost as much as seven million pounds.",2
248,"The collection of incredible beauty will be sold only in the new Dolce & Gabbana boutique in Tretyakovsky Proyezd from October 24th. And most importantly, on October 29, Domenico Dolce and Stefano Gabbana will personally come to acquaint fans of the brand with a luxurious Russian collection.",2
249,"Miuccia Prada is famous for her love of art, and for her next Miu Miu show, she commissioned unusual black and white posters from the Parisian creative agency MM Paris. Especially for the Italian brand, they developed the “female” alphabet An ABC of Actions, Behaviors & Comporment, painted female graffiti portraits on them, and then hung the entire Palais d'Iéna, in which the show took place.",2
250,"Rough girls in heavy boots and studded jackets have become one of the key sources of inspiration for designers, so all fans of heavy music and Goth aesthetics can give free rein. This style is most evident in the collection of Alexander Wang for his own brand, but more delicate versions of the ""romance of death"" can be found at Balenciaga, Givenchy and No. 21. Read more about the different incarnations of this trend here.",2
251,"Velvet and velor are the most sophisticated and theatrical fabrics that turn even a simple top into a piece for special occasions. Alessandro Michele chose “dusty” aged shades for the Gucci collections, Giorgio Armani and Christopher Kane demonstrated simply cosmic ability to work with color, and most designers preferred black and deep blue - velvet things look especially luxurious in them.",2
252,"How to Choose a Moisturizer ""Moisturizing the skin is vital to skin health and also helps maintain the integrity of the epidermal protective barrier,"" says dermatologist and Decree founder Dr. Anita Sternham. “Skin needs change from day to day, and factors such as stress, hormones, travel and lifestyle all affect hydration levels and can cause dryness. I recommend always having two moisturizers: a light one and a richer one. Study your skin: find out how it reacts to each product in order to understand which one it needs in the end.",2
